{
  "id": "8284-westwood-st",
  "status": "available",
  "strategy": ["rental"],
  "address": "8284 Westwood St",
  "city": "Detroit",
  "state": "MI",
  "zip": "48228",
  "price": 79900,
  "arv": 117500,
  "estRehab": 25000,
  "beds": 3,
  "baths": 1,
  "sqft": 952,
  "lotSqft": 5227,
  "yearBuilt": 1942,
  "propertyType": "Single Family — Bungalow",
  "occupancy": "Vacant at closing",
  "description": "Vacant value-add bungalow in 48228 with a 1-car detached garage, finished basement, and vinyl windows — HVAC and roof reported functional, so the scope is mostly cosmetic-to-intermediate ($18–28k for rental-grade, $30–40k for a retail finish). At ask plus $25k of work the basis sits near $105k against renovated 3/1 sales running $110k–$135k on the surrounding blocks. Rents pencil at $1,250–$1,350 — underwritten here at $1,300 with estimated insurance — making this a clean BRRRR, turnkey-hold, or wholetail play. Off-market, delivered vacant at closing.",
  "highlights": [
    "Vacant at closing — off-market",
    "HVAC and roof reported functional",
    "Finished basement + 1-car detached garage",
    "Renovated 3/1 comps $110k–$135k nearby"
  ],
  "photos": [
    "/deals/8284-westwood-st/1.jpg",
    "/deals/8284-westwood-st/2.jpg",
    "/deals/8284-westwood-st/3.jpg",
    "/deals/8284-westwood-st/4.jpg",
    "/deals/8284-westwood-st/5.jpg",
    "/deals/8284-westwood-st/6.jpg",
    "/deals/8284-westwood-st/7.jpg",
    "/deals/8284-westwood-st/8.jpg",
    "/deals/8284-westwood-st/9.jpg",
    "/deals/8284-westwood-st/10.jpg",
    "/deals/8284-westwood-st/11.jpg",
    "/deals/8284-westwood-st/12.jpg",
    "/deals/8284-westwood-st/13.jpg",
    "/deals/8284-westwood-st/14.jpg",
    "/deals/8284-westwood-st/15.jpg",
    "/deals/8284-westwood-st/16.jpg",
    "/deals/8284-westwood-st/17.jpg",
    "/deals/8284-westwood-st/18.jpg",
    "/deals/8284-westwood-st/19.jpg",
    "/deals/8284-westwood-st/20.jpg",
    "/deals/8284-westwood-st/21.jpg",
    "/deals/8284-westwood-st/22.jpg",
    "/deals/8284-westwood-st/23.jpg",
    "/deals/8284-westwood-st/24.jpg",
    "/deals/8284-westwood-st/25.jpg",
    "/deals/8284-westwood-st/26.jpg",
    "/deals/8284-westwood-st/27.jpg",
    "/deals/8284-westwood-st/28.jpg",
    "/deals/8284-westwood-st/29.jpg",
    "/deals/8284-westwood-st/30.jpg",
    "/deals/8284-westwood-st/31.jpg",
    "/deals/8284-westwood-st/32.jpg",
    "/deals/8284-westwood-st/33.jpg",
    "/deals/8284-westwood-st/34.jpg"
  ],
  "rental": {
    "monthlyRent": 1300,
    "taxesAnnual": 1225,
    "insuranceAnnual": 1100
  },
  "comps": [
    { "address": "8244 Westwood St", "price": 89900, "note": "3/1, 943 sqft — very close baseline comp" },
    { "address": "8115 Grandville Ave", "price": 103000, "note": "3/1, 907 sqft — strong close support" },
    { "address": "7805 Warwick St", "price": 115000, "note": "3/1, 972 sqft — renovated/value support" },
    { "address": "9025 Braile St", "price": 115000, "note": "3/1, 980 sqft — similar flip proof" },
    { "address": "7403 Patton St", "price": 125000, "note": "3/1, 960 sqft — strong renovated support" },
    { "address": "8679 Burt Rd", "price": 127000, "note": "3/1, 981 sqft — strong renovated support" },
    { "address": "9221 Grandville Ave", "price": 135000, "note": "3/1, 971 sqft — high-end upside support" }
  ]
}
