{
  "id": "8830-piedmont-st",
  "status": "pending",
  "strategy": ["rental"],
  "address": "8830 Piedmont St",
  "city": "Detroit",
  "state": "MI",
  "zip": "48228",
  "price": 72500,
  "arv": 118000,
  "estRehab": 32000,
  "beds": 3,
  "baths": 1,
  "sqft": 1102,
  "lotSqft": 4356,
  "yearBuilt": 1942,
  "propertyType": "Single Family",
  "occupancy": "Vacant",
  "description": "Warrendale three-bed priced under comps for a fast close. Full interior rehab, but the bones are right — dry basement, straight roofline, original hardwoods under carpet. Section 8 demand in this zip keeps vacancy near zero.",
  "highlights": [
    "Under-market entry for the block",
    "Original hardwoods throughout",
    "Strong Section 8 demand in 48228",
    "Dry basement, straight roofline"
  ],
  "photos": [
    "https://picsum.photos/seed/zona-piedmont-1/1200/800",
    "https://picsum.photos/seed/zona-piedmont-2/1200/800",
    "https://picsum.photos/seed/zona-piedmont-3/1200/800"
  ],
  "rental": {
    "monthlyRent": 1250,
    "taxesAnnual": 1650,
    "insuranceAnnual": 1150,
    "section8": true
  },
  "terms": {
    "emd": 2000,
    "closeMethod": "Assignment",
    "access": "By appointment"
  }
}
