{
  "id": "4123-three-mile-dr",
  "status": "available",
  "strategy": ["rental", "flip"],
  "address": "4123 Three Mile Dr",
  "city": "Detroit",
  "state": "MI",
  "zip": "48224",
  "price": 129000,
  "arv": 185000,
  "estRehab": 25000,
  "beds": 3,
  "baths": 2,
  "sqft": 1480,
  "lotSqft": 4800,
  "yearBuilt": 1949,
  "propertyType": "Single Family",
  "occupancy": "Vacant at close",
  "description": "Solid brick bungalow in East English Village, one of Detroit's steadiest rental pockets. Roof and furnace are newer; the rehab is cosmetic — paint, floors, kitchen refresh. Rents in this corridor support $1,600+ with strong tenant demand year round.",
  "highlights": [
    "Brick construction, newer roof and furnace",
    "Cosmetic rehab only — no structural work",
    "East English Village rental comps at $1,600–$1,750/mo",
    "Clean title, vacant at close"
  ],
  "photos": [
    "https://picsum.photos/seed/zona-three-mile-1/1200/800",
    "https://picsum.photos/seed/zona-three-mile-2/1200/800",
    "https://picsum.photos/seed/zona-three-mile-3/1200/800",
    "https://picsum.photos/seed/zona-three-mile-4/1200/800"
  ],
  "rental": {
    "monthlyRent": 1650,
    "taxesAnnual": 2350,
    "insuranceAnnual": 1300,
    "hoaMonthly": 0,
    "vacancyPct": 8,
    "section8": true
  },
  "terms": {
    "emd": 2500,
    "closeMethod": "Assignment",
    "access": "Lockbox — text for code"
  },
  "comps": [
    { "address": "4310 Three Mile Dr", "price": 182000, "note": "Renovated, sold May 2026" },
    { "address": "3986 Bishop St", "price": 189500, "note": "Same block quality, sold Mar 2026" }
  ],
  "closeBy": "2026-07-15",
  "featured": true
}
